{
  "format": "mathos-life-run",
  "schemaVersion": 1,
  "name": "Pixel life baseline",
  "seed": 42,
  "universe": {
    "width": 16,
    "height": 16
  },
  "engine": "life-reference@1",
  "rng": "mulberry32@1",
  "genesis": {
    "mode": "seeded",
    "recipe": "resource-noise@1",
    "template": "center-cell@1"
  },
  "rules": {
    "id": "pixel-life@1",
    "boundary": "periodic",
    "transferDivisor": 8
  }
}
